{
  "$id": "https://single-image-studio.invalid/research/slice-07/schemas/run-result.slice07.v0.schema.json",
  "$schema": "https://json-schema.org/draft/2020-12/schema",
  "additionalProperties": false,
  "properties": {
    "actualCode": {
      "oneOf": [
        {
          "type": "null"
        },
        {
          "pattern": "^S07_[A-Z0-9_]+$",
          "type": "string"
        }
      ]
    },
    "attemptId": {
      "pattern": "^[A-Za-z0-9][A-Za-z0-9._:@-]{0,199}$",
      "type": "string"
    },
    "closureRef": {
      "oneOf": [
        {
          "type": "null"
        },
        {
          "pattern": "^[A-Za-z0-9][A-Za-z0-9._:@-]{0,199}$",
          "type": "string"
        }
      ]
    },
    "contentHash": {
      "pattern": "^[a-f0-9]{64}$",
      "type": "string"
    },
    "decodedPixelSha256": {
      "oneOf": [
        {
          "type": "null"
        },
        {
          "pattern": "^[a-f0-9]{64}$",
          "type": "string"
        }
      ]
    },
    "disposition": {
      "enum": [
        "applicable",
        "rejection"
      ]
    },
    "evidenceBoundary": {
      "additionalProperties": false,
      "properties": {
        "C1": {
          "const": 0
        },
        "E1": {
          "const": 0
        },
        "G1": {
          "const": 0
        },
        "O1": {
          "const": 0
        },
        "R1": {
          "const": 0
        },
        "U1": {
          "const": 0
        },
        "V1": {
          "const": 0
        },
        "formal": {
          "const": false
        },
        "productSupport": {
          "const": false
        },
        "releaseAllowlist": {
          "const": "none"
        },
        "releaseApproved": {
          "const": 0
        },
        "releaseRegistered": {
          "const": 0
        }
      },
      "required": [
        "C1",
        "U1",
        "E1",
        "R1",
        "O1",
        "G1",
        "V1",
        "productSupport",
        "formal",
        "releaseAllowlist",
        "releaseRegistered",
        "releaseApproved"
      ],
      "type": "object"
    },
    "fileSha256": {
      "oneOf": [
        {
          "type": "null"
        },
        {
          "pattern": "^[a-f0-9]{64}$",
          "type": "string"
        }
      ]
    },
    "operation": {
      "enum": [
        "normalize",
        "export"
      ]
    },
    "repetition": {
      "maximum": 3,
      "minimum": 1,
      "type": "integer"
    },
    "requestId": {
      "pattern": "^[A-Za-z0-9][A-Za-z0-9._:@-]{0,199}$",
      "type": "string"
    },
    "resultId": {
      "pattern": "^[A-Za-z0-9][A-Za-z0-9._:@-]{0,199}$",
      "type": "string"
    },
    "schemaVersion": {
      "const": "run-result.slice07.v0"
    },
    "sourceId": {
      "pattern": "^[A-Za-z0-9][A-Za-z0-9._:@-]{0,199}$",
      "type": "string"
    },
    "status": {
      "enum": [
        "pass",
        "non-pass"
      ]
    },
    "workerExitConfirmed": {
      "type": "boolean"
    }
  },
  "required": [
    "schemaVersion",
    "resultId",
    "requestId",
    "attemptId",
    "operation",
    "sourceId",
    "repetition",
    "disposition",
    "status",
    "actualCode",
    "closureRef",
    "fileSha256",
    "decodedPixelSha256",
    "workerExitConfirmed",
    "evidenceBoundary",
    "contentHash"
  ],
  "type": "object"
}
