{"actualCode":null,"attemptId":"s07.normalize.source.s07.normalize.smoke.002.r3","closureRef":"closure.s07.normalize.source.s07.normalize.smoke.002.r3","contentHash":"620956659d461482fcff1aa1e39b27f7b6705fc59564993e6ef5a9b5c33ab211","decodedPixelSha256":"cbe7e8f4cf08cd859a040c77e7163246a0de03fdae25a11be6d4a0d91967d7c4","disposition":"applicable","evidenceBoundary":{"C1":0,"E1":0,"G1":0,"O1":0,"R1":0,"U1":0,"V1":0,"formal":false,"productSupport":false,"releaseAllowlist":"none","releaseApproved":0,"releaseRegistered":0},"fileSha256":"d42d468df7aa602e2f2497ce48ab856c0c9e08c0169083167daf416918380aa5","operation":"normalize","repetition":3,"requestId":"request.s07.normalize.source.s07.normalize.smoke.002.r3","resultId":"result.s07.normalize.source.s07.normalize.smoke.002.r3","schemaVersion":"run-result.slice07.v0","sourceId":"source.s07.normalize.smoke.002","status":"pass","workerExitConfirmed":true}
