{"actualCode":"ERR_INVALID_ARG_TYPE","attemptId":"s07.normalize.source.s07.normalize.smoke.006.r3","closureRef":null,"contentHash":"e208a712975709c936c1f3749e36f4cc4e5ebb30bd27768a94401654a7b77c60","decodedPixelSha256":null,"disposition":"rejection","evidenceBoundary":{"C1":0,"E1":0,"G1":0,"O1":0,"R1":0,"U1":0,"V1":0,"formal":false,"productSupport":false,"releaseAllowlist":"none","releaseApproved":0,"releaseRegistered":0},"fileSha256":null,"operation":"normalize","repetition":3,"requestId":"request.s07.normalize.source.s07.normalize.smoke.006.r3","resultId":"result.s07.normalize.source.s07.normalize.smoke.006.r3","schemaVersion":"run-result.slice07.v0","sourceId":"source.s07.normalize.smoke.006","status":"non-pass","workerExitConfirmed":false}
