{"actualCode":null,"attemptId":"s07.export.source.s07.export.smoke.001.r3","closureRef":"closure.s07.export.source.s07.export.smoke.001.r3","contentHash":"663c296c7e196b24b096b8068fcc20f90584b1a337ff1ad092264c88c8701ab9","decodedPixelSha256":"bbc41256a04bc2a1fc3b2192d861471706b301433b79fe2c8170ad732cae139d","disposition":"applicable","evidenceBoundary":{"C1":0,"E1":0,"G1":0,"O1":0,"R1":0,"U1":0,"V1":0,"formal":false,"productSupport":false,"releaseAllowlist":"none","releaseApproved":0,"releaseRegistered":0},"fileSha256":"9f47c00b7619e856b1ea35d09fcf39cda3bc8d66668f83cc19efe64704af6fd4","operation":"export","repetition":3,"requestId":"request.s07.export.source.s07.export.smoke.001.r3","resultId":"result.s07.export.source.s07.export.smoke.001.r3","schemaVersion":"run-result.slice07.v0","sourceId":"source.s07.export.smoke.001","status":"pass","workerExitConfirmed":true}
