{"actualCode":"ERR_INVALID_ARG_TYPE","attemptId":"s07.export.source.s07.export.smoke.006.r3","closureRef":null,"contentHash":"a3f2a583b5a545b3cb42619d3ac899cb1e53523b9ad8c8c3785c295b6cfeafc1","decodedPixelSha256":null,"disposition":"rejection","evidenceBoundary":{"C1":0,"E1":0,"G1":0,"O1":0,"R1":0,"U1":0,"V1":0,"formal":false,"productSupport":false,"releaseAllowlist":"none","releaseApproved":0,"releaseRegistered":0},"fileSha256":null,"operation":"export","repetition":3,"requestId":"request.s07.export.source.s07.export.smoke.006.r3","resultId":"result.s07.export.source.s07.export.smoke.006.r3","schemaVersion":"run-result.slice07.v0","sourceId":"source.s07.export.smoke.006","status":"non-pass","workerExitConfirmed":false}
